{
  "registryType": "CGBC_CONCEPT_REGISTRY",
  "registryVersion": "1.0",
  "generatedAt": "2026-10-11T10:00:00-05:00",
  "sourceBaseCommit": "5ceefc5db4a5f0e10cab1a6db888f862ed7c6c29",
  "description": "Conservative starter registry for durable semantic concepts already evidenced in CGBC canonical sermon records. Doctrine taxonomy remains separate classification vocabulary.",
  "governance": {
    "principle": "Capture locally once. Normalize globally. Generate search separately.",
    "candidatePolicy": "Use conceptCandidates in sermon records for meaningful concepts not yet approved in this registry; do not silently mint permanent IDs during routine weekly work.",
    "scopeNote": "Aliases aid normalization after node meaning has been established from sermon evidence; alias matching alone is not proof that a concept was taught."
  },
  "concepts": [
    {
      "conceptId": "christ.foundation",
      "label": "Christ as the Foundation",
      "aliases": [
        "Christ as foundation",
        "church foundation",
        "foundation"
      ],
      "relatedConceptIds": [
        "christ.lordship",
        "church.core-values"
      ]
    },
    {
      "conceptId": "christ.lordship",
      "label": "Lordship of Christ",
      "aliases": [
        "lordship of Christ"
      ],
      "relatedConceptIds": [
        "christ.foundation",
        "christ.identity"
      ]
    },
    {
      "conceptId": "christ.identity",
      "label": "Identity of Christ",
      "aliases": [
        "identity of Christ",
        "deity of Christ",
        "eternity of Christ"
      ],
      "relatedConceptIds": [
        "christ.lordship",
        "trinity"
      ]
    },
    {
      "conceptId": "christ.ascension",
      "label": "Ascension of Christ",
      "aliases": [
        "ascension"
      ],
      "relatedConceptIds": [
        "christ.return"
      ]
    },
    {
      "conceptId": "christ.return",
      "label": "Return of Christ",
      "aliases": [
        "return of Christ",
        "second coming"
      ],
      "relatedConceptIds": [
        "christ.ascension",
        "christian-life.hope"
      ]
    },
    {
      "conceptId": "christ.reign",
      "label": "Reign of Christ",
      "aliases": [
        "reign of Christ",
        "King of kings",
        "rod of iron"
      ],
      "relatedConceptIds": [
        "christ.return",
        "christ.lordship"
      ]
    },
    {
      "conceptId": "christ.authority",
      "label": "Authority of Christ",
      "aliases": [
        "authority of Christ",
        "name of Jesus"
      ],
      "relatedConceptIds": [
        "christ.lordship"
      ]
    },
    {
      "conceptId": "christ.atonement",
      "label": "Atonement and the Blood of Christ",
      "aliases": [
        "atonement",
        "blood of Christ",
        "blood of the Lamb",
        "payment for sin"
      ],
      "relatedConceptIds": [
        "salvation.assurance",
        "salvation.gospel"
      ]
    },
    {
      "conceptId": "god.love",
      "label": "Love of God",
      "aliases": [
        "God's love"
      ],
      "relatedConceptIds": [
        "salvation.grace",
        "love.unconditional"
      ]
    },
    {
      "conceptId": "god.goodness",
      "label": "Goodness of God",
      "aliases": [
        "God's goodness",
        "good gifts"
      ],
      "relatedConceptIds": [
        "god.providence",
        "christian-life.trust-god"
      ]
    },
    {
      "conceptId": "god.providence",
      "label": "Providence and God's Wise Choices",
      "aliases": [
        "providence",
        "God's choices",
        "choices"
      ],
      "relatedConceptIds": [
        "god.goodness",
        "christian-life.trust-god"
      ]
    },
    {
      "conceptId": "god.impartiality",
      "label": "Impartiality of God",
      "aliases": [
        "impartiality",
        "God's standards"
      ],
      "relatedConceptIds": [
        "salvation.grace"
      ]
    },
    {
      "conceptId": "god.immutability",
      "label": "Immutability of God",
      "aliases": [
        "immutability of God"
      ],
      "relatedConceptIds": [
        "trinity"
      ]
    },
    {
      "conceptId": "god.justice-and-wrath",
      "label": "Justice and Wrath of God",
      "aliases": [
        "justice",
        "wrath"
      ],
      "relatedConceptIds": [
        "god.immutability"
      ]
    },
    {
      "conceptId": "god.divine-protection",
      "label": "Divine Protection",
      "aliases": [
        "divine protection",
        "protection",
        "deliverance"
      ],
      "relatedConceptIds": [
        "christian-life.hope"
      ]
    },
    {
      "conceptId": "trinity",
      "label": "Trinity",
      "aliases": [
        "Trinity"
      ],
      "relatedConceptIds": [
        "christ.identity",
        "god.immutability"
      ]
    },
    {
      "conceptId": "salvation.gospel",
      "label": "The Gospel",
      "aliases": [
        "gospel",
        "good news"
      ],
      "relatedConceptIds": [
        "christ.atonement",
        "church.evangelism"
      ]
    },
    {
      "conceptId": "salvation.grace",
      "label": "Salvation by Grace",
      "aliases": [
        "grace",
        "grace-based salvation",
        "gift"
      ],
      "relatedConceptIds": [
        "salvation.faith-not-works",
        "god.love"
      ]
    },
    {
      "conceptId": "salvation.faith-not-works",
      "label": "Salvation by Faith, Not Works",
      "aliases": [
        "work-based salvation",
        "faith-based salvation",
        "grace versus works"
      ],
      "relatedConceptIds": [
        "salvation.grace",
        "salvation.gospel"
      ]
    },
    {
      "conceptId": "salvation.assurance",
      "label": "Assurance and Security in Christ",
      "aliases": [
        "assurance",
        "security",
        "God's keeping"
      ],
      "relatedConceptIds": [
        "christ.atonement",
        "satan.accusation"
      ]
    },
    {
      "conceptId": "salvation.response",
      "label": "Response to the Gospel",
      "aliases": [
        "salvation response"
      ],
      "relatedConceptIds": [
        "salvation.gospel",
        "salvation.urgency"
      ]
    },
    {
      "conceptId": "salvation.urgency",
      "label": "Urgency of Responding to God",
      "aliases": [
        "urgency",
        "delay",
        "tomorrow",
        "now"
      ],
      "relatedConceptIds": [
        "salvation.response"
      ]
    },
    {
      "conceptId": "salvation.dependence",
      "label": "Dependence on God for Salvation",
      "aliases": [
        "dependency",
        "need"
      ],
      "relatedConceptIds": [
        "salvation.grace"
      ]
    },
    {
      "conceptId": "church.vision",
      "label": "CGBC Vision",
      "aliases": [
        "vision"
      ],
      "relatedConceptIds": [
        "church.mission",
        "church.core-values",
        "church.community"
      ]
    },
    {
      "conceptId": "church.community",
      "label": "Church Community",
      "aliases": [
        "community"
      ],
      "relatedConceptIds": [
        "church.relationships",
        "church.mutual-encouragement"
      ]
    },
    {
      "conceptId": "church.core-values",
      "label": "CGBC Core Values",
      "aliases": [
        "core values",
        "CGBC core values",
        "Upon This Rock"
      ],
      "relatedConceptIds": [
        "church.relationships",
        "church.commitment",
        "church.vision"
      ]
    },
    {
      "conceptId": "church.relationships",
      "label": "Christian and Church Relationships",
      "aliases": [
        "relationships",
        "Relationships",
        "church relationships",
        "Christian relationships"
      ],
      "relatedConceptIds": [
        "love.unconditional",
        "church.core-values"
      ]
    },
    {
      "conceptId": "church.commitment",
      "label": "Commitment to the Local Church",
      "aliases": [
        "commitment"
      ],
      "relatedConceptIds": [
        "church.membership",
        "church.core-values"
      ]
    },
    {
      "conceptId": "church.membership",
      "label": "Church Membership",
      "aliases": [
        "church membership",
        "membership"
      ],
      "relatedConceptIds": [
        "church.commitment"
      ]
    },
    {
      "conceptId": "church.mission",
      "label": "Mission of the Church",
      "aliases": [
        "mission"
      ],
      "relatedConceptIds": [
        "church.evangelism",
        "church.great-commission"
      ]
    },
    {
      "conceptId": "church.evangelism",
      "label": "Evangelism and Gospel Proclamation",
      "aliases": [
        "evangelism",
        "gospel proclamation",
        "witness",
        "leading people to Christ"
      ],
      "relatedConceptIds": [
        "salvation.gospel",
        "church.mission"
      ]
    },
    {
      "conceptId": "church.great-commission",
      "label": "The Great Commission",
      "aliases": [
        "Great Commission"
      ],
      "relatedConceptIds": [
        "church.evangelism",
        "church.mission"
      ]
    },
    {
      "conceptId": "church.every-member-ministry",
      "label": "Every-Member Ministry",
      "aliases": [
        "every-member ministry"
      ],
      "relatedConceptIds": [
        "church.evangelism",
        "church.service"
      ]
    },
    {
      "conceptId": "church.growth",
      "label": "Church Growth for Gospel Ends",
      "aliases": [
        "church growth"
      ],
      "relatedConceptIds": [
        "church.evangelism",
        "church.health"
      ]
    },
    {
      "conceptId": "church.health",
      "label": "Church Health",
      "aliases": [
        "church health"
      ],
      "relatedConceptIds": [
        "bible.spiritual-hunger",
        "church.commitment"
      ]
    },
    {
      "conceptId": "church.corporate-gathering",